<?xml version="1.0" encoding="utf-8" ?>

<xs:schema xmlns="http://www.secunet.com" targetNamespace="http://www.secunet.com" xmlns:xs="http://www.w3.org/2001/XMLSchema" elementFormDefault="qualified">

	<!-- types for the XML doc -->
	<xs:simpleType name="algorithmType">
		<xs:restriction base="xs:string">
			<xs:enumeration value="TA_RSA_v1_5_SHA_1" />
			<xs:enumeration value="TA_RSA_v1_5_SHA_256" />
			<xs:enumeration value="TA_RSA_PSS_SHA_1" />
			<xs:enumeration value="TA_RSA_PSS_SHA_256" />
			<xs:enumeration value="TA_ECDSA_SHA_1" />
			<xs:enumeration value="TA_ECDSA_SHA_224" />
			<xs:enumeration value="TA_ECDSA_SHA_256" />
		</xs:restriction>
	</xs:simpleType>

	<xs:complexType name="publicKeyType" >
		<xs:simpleContent>
			<xs:extension base="xs:string">
				<xs:attribute name="domainParam" type="xs:boolean"/> <!-- default: false -->
			</xs:extension>
		</xs:simpleContent>	
	</xs:complexType>
	
	<xs:complexType name="signKeyType">
		<xs:simpleContent>
			<xs:extension base="xs:string" />
		</xs:simpleContent>	
	</xs:complexType>

	<xs:complexType name="certHolderAuthType">
		<xs:sequence>
			<xs:element name="role" type="roleType" />
			<xs:element name="writeDG17" type="xs:boolean" minOccurs="0" maxOccurs="1" />
			<xs:element name="writeDG18" type="xs:boolean" minOccurs="0" maxOccurs="1" />
			<xs:element name="writeDG19" type="xs:boolean" minOccurs="0" maxOccurs="1" />
			<xs:element name="writeDG20" type="xs:boolean" minOccurs="0" maxOccurs="1" />
			<xs:element name="writeDG21" type="xs:boolean" minOccurs="0" maxOccurs="1" />
			<xs:element name="readDG1" type="xs:boolean" minOccurs="0" maxOccurs="1" />
			<xs:element name="readDG2" type="xs:boolean" minOccurs="0" maxOccurs="1" />
			<xs:element name="readDG3" type="xs:boolean" minOccurs="0" maxOccurs="1" />
			<xs:element name="readDG4" type="xs:boolean" minOccurs="0" maxOccurs="1" />
			<xs:element name="readDG5" type="xs:boolean" minOccurs="0" maxOccurs="1" />
			<xs:element name="readDG6" type="xs:boolean" minOccurs="0" maxOccurs="1" />
			<xs:element name="readDG7" type="xs:boolean" minOccurs="0" maxOccurs="1" />
			<xs:element name="readDG8" type="xs:boolean" minOccurs="0" maxOccurs="1" />
			<xs:element name="readDG9" type="xs:boolean" minOccurs="0" maxOccurs="1" />
			<xs:element name="readDG10" type="xs:boolean" minOccurs="0" maxOccurs="1" />
			<xs:element name="readDG11" type="xs:boolean" minOccurs="0" maxOccurs="1" />
			<xs:element name="readDG12" type="xs:boolean" minOccurs="0" maxOccurs="1" />
			<xs:element name="readDG13" type="xs:boolean" minOccurs="0" maxOccurs="1" />
			<xs:element name="readDG14" type="xs:boolean" minOccurs="0" maxOccurs="1" />
			<xs:element name="readDG15" type="xs:boolean" minOccurs="0" maxOccurs="1" />
			<xs:element name="readDG16" type="xs:boolean" minOccurs="0" maxOccurs="1" />
			<xs:element name="readDG17" type="xs:boolean" minOccurs="0" maxOccurs="1" />
			<xs:element name="readDG18" type="xs:boolean" minOccurs="0" maxOccurs="1" />
			<xs:element name="readDG19" type="xs:boolean" minOccurs="0" maxOccurs="1" />
			<xs:element name="readDG20" type="xs:boolean" minOccurs="0" maxOccurs="1" />
			<xs:element name="readDG21" type="xs:boolean" minOccurs="0" maxOccurs="1" />
			<xs:element name="installQualifiedCertificate" type="xs:boolean" minOccurs="0" maxOccurs="1" />
			<xs:element name="installCertificate" type="xs:boolean" minOccurs="0" maxOccurs="1" />
			<xs:element name="pinManagement" type="xs:boolean" minOccurs="0" maxOccurs="1" />
			<xs:element name="canAllowed" type="xs:boolean" minOccurs="0" maxOccurs="1" />
			<xs:element name="privilegedTerminal" type="xs:boolean" minOccurs="0" maxOccurs="1" />
			<xs:element name="restrictedIdentification" type="xs:boolean" minOccurs="0" maxOccurs="1" />
			<xs:element name="communityIDVerification" type="xs:boolean" minOccurs="0" maxOccurs="1" />
			<xs:element name="ageVerification" type="xs:boolean" minOccurs="0" maxOccurs="1" />
			<xs:element name="readEPassDG3" type="xs:boolean" minOccurs="0" maxOccurs="1" />
			<xs:element name="readEPassDG4" type="xs:boolean" minOccurs="0" maxOccurs="1" />
			<xs:element name="generateQualifiedElectronicSignature" type="xs:boolean" minOccurs="0" maxOccurs="1" />
			<xs:element name="generateElectronicSignature" type="xs:boolean" minOccurs="0" maxOccurs="1" />
		</xs:sequence>
		<xs:attribute name="type" type="terminalType" use="required" />
		<xs:attribute name="forceOID" type="xs:hexBinary" use="optional" />
	</xs:complexType>

	<xs:simpleType name="roleType">
		<xs:restriction base="xs:string">
			<xs:enumeration value="CVCA" />
			<xs:enumeration value="DV_DOMESTIC" />
			<xs:enumeration value="DV_FOREIGN" />
			<xs:enumeration value="TERMINAL" />
		</xs:restriction>
	</xs:simpleType>
	
	<xs:simpleType name="terminalType">
		<xs:restriction base="xs:string">
			<xs:enumeration value="AT" />
			<xs:enumeration value="IS" />
			<xs:enumeration value="ST" />
		</xs:restriction>
	</xs:simpleType>
	
	<xs:simpleType name="profileIdType">
		<xs:restriction base="xs:integer">
			<xs:pattern value="[0-9]{1}" />
		</xs:restriction>
	</xs:simpleType>
	
	<xs:complexType name="keyType">
		<xs:sequence>
			<xs:element name="filePrivateKey" type="xs:string" />
			<xs:element name="filePublicKey" type="xs:string" minOccurs="0" maxOccurs="1" />
			<xs:sequence>
				<xs:element name="algorithm" type="algorithmType" />
				<xs:choice>
					<xs:element name ="ecdsa" type="ecdsaType" />
					<xs:element name="rsa">
						<xs:complexType>
							<xs:sequence>
								<xs:element name="publicExpo" type="xs:integer" minOccurs="0"/>
								<xs:element name="length" type="keyLengthType" />
							</xs:sequence>
						</xs:complexType>
					</xs:element>
				</xs:choice>
			</xs:sequence>
		</xs:sequence>
		<xs:attribute name="name" type="xs:string" use="required" />
		<xs:attribute name="create" type="xs:boolean" /> <!-- default: false -->
	</xs:complexType>
	
	<xs:complexType name="descriptionType">
		<xs:sequence>
			<xs:element name="issuerName" type="xs:string" minOccurs="0" maxOccurs="1" />
			<xs:element name="issuerURL" type="xs:string" minOccurs="0" maxOccurs="1" />
			<xs:element name="subjectName" type="xs:string" minOccurs="0" maxOccurs="1" />
			<xs:element name="subjectURL" type="xs:string" minOccurs="0" maxOccurs="1" />
			<xs:choice>
				<xs:element name="fileTermsOfUsage" type="xs:string" minOccurs="0" maxOccurs="1" />
				<xs:element name="termsOfUsage" type="xs:string" minOccurs="0" maxOccurs="1" />
			</xs:choice>
			<xs:element name="redirectURL" type="xs:string" minOccurs="0" maxOccurs="1" />
			<xs:element name="commCerts" minOccurs="0" maxOccurs="1">
				<xs:complexType>
					<xs:sequence>
						<xs:element name="fileCommCert" type="xs:string" minOccurs="0" maxOccurs="unbounded" />
						<xs:element name="hashCommCert" type="xs:string" minOccurs="0" maxOccurs="unbounded" />
					</xs:sequence>
				</xs:complexType>
			</xs:element>
			<xs:element name="fileDescription" type="xs:string" minOccurs="0" maxOccurs="1" />
		</xs:sequence>
		<xs:attribute name="import" type="xs:boolean" /> <!-- default: false -->
	</xs:complexType>
	
	<xs:complexType name="terminalSectorType">
		<xs:sequence>
			<xs:element name="fileSectorPublicKey" type="xs:string" minOccurs="0" maxOccurs="unbounded" />
		</xs:sequence>
	</xs:complexType>

	<xs:simpleType name="ecdsaType">
		<xs:restriction base="xs:string">
			<xs:enumeration value="ASN1::secp112r1" />
			<xs:enumeration value="ASN1::secp112r2" />
			<xs:enumeration value="ASN1::secp128r1" />
			<xs:enumeration value="ASN1::secp128r2" />
			<xs:enumeration value="ASN1::secp160r1" />
			<xs:enumeration value="ASN1::secp160k1" />
			<xs:enumeration value="ASN1::secp160r2" />
			<xs:enumeration value="ASN1::secp192k1" />
			<xs:enumeration value="ASN1::secp192r1" />
			<xs:enumeration value="ASN1::secp224k1" />
			<xs:enumeration value="ASN1::secp224r1" />
			<xs:enumeration value="ASN1::secp256k1" />
			<xs:enumeration value="ASN1::secp256r1" />
			<xs:enumeration value="ASN1::secp384r1" />
			<xs:enumeration value="ASN1::secp521r1" />
			<xs:enumeration value="BRAINPOOL::p160r1" />
			<xs:enumeration value="BRAINPOOL::p160t1" />
			<xs:enumeration value="BRAINPOOL::p192r1" />
            <xs:enumeration value="BRAINPOOL::p192t1" />
			<xs:enumeration value="BRAINPOOL::p224r1" />
			<xs:enumeration value="BRAINPOOL::p224t1" />
			<xs:enumeration value="BRAINPOOL::p256r1" />
			<xs:enumeration value="BRAINPOOL::p256t1" />
			<xs:enumeration value="BRAINPOOL::p320r1" />
			<xs:enumeration value="BRAINPOOL::p320t1" />
			<xs:enumeration value="BRAINPOOL::p384r1" />
			<xs:enumeration value="BRAINPOOL::p384t1" />
			<xs:enumeration value="BRAINPOOL::p512r1" />
			<xs:enumeration value="BRAINPOOL::p512t1" />
		</xs:restriction>	
	</xs:simpleType>
	
	<xs:simpleType name="keyLengthType">
		<xs:restriction base="xs:integer">
			<xs:enumeration value="512" />
			<xs:enumeration value="1024" />
			<xs:enumeration value="1280" />
			<xs:enumeration value="1536" />
			<xs:enumeration value="2048" />
			<xs:enumeration value="3072" />
		</xs:restriction>
	</xs:simpleType>
	
	<!-- structure of the XML doc -->
	<xs:element name="root">
		<xs:complexType>
			<xs:sequence>
				<xs:element name="keys" minOccurs="0" maxOccurs="1">
					<xs:complexType>
						<xs:sequence>
							<xs:element name="key" type="keyType" minOccurs="0" maxOccurs="unbounded" />
						</xs:sequence>
					</xs:complexType>
				</xs:element>
				<xs:element name="cert" type="certType" maxOccurs="unbounded" />			</xs:sequence>
		</xs:complexType>
	</xs:element>

	<xs:complexType name="certType">
		<xs:sequence>
			<xs:element name="profileId" type="profileIdType" />
			<xs:element name="certAuthRef" type="xs:string" />
			<xs:element name="publicKey" type="publicKeyType" maxOccurs="1" />
			<xs:element name="certHolderRef" type="xs:string" />
			<xs:element name="certHolderAuth" type="certHolderAuthType" minOccurs="0" maxOccurs="1" />
			<xs:choice>
				<xs:element name="effDate" type="xs:date" />
				<xs:element name="effDateOffset" type="xs:integer" />
			</xs:choice>
			<xs:choice>
				<xs:element name="expDate" type="xs:date" />
				<xs:element name="expDateOffset" type="xs:integer" />
			</xs:choice>
			<xs:element name="extensions" minOccurs="0" maxOccurs="1">
				<xs:complexType>
					<xs:sequence>
						<xs:element name="description" type="descriptionType" minOccurs="0" maxOccurs="1" />
						<xs:element name="terminalSector" type="terminalSectorType" minOccurs="0" maxOccurs="2" />
					</xs:sequence>
				</xs:complexType>
			</xs:element>
			<xs:element name="signKey" type="signKeyType" maxOccurs="1" />
			<xs:element minOccurs="0" maxOccurs="1" name="outputFile">
				<xs:complexType>
					<xs:simpleContent>
						<xs:extension base="xs:string">
							<xs:attribute name="createAdditionalHexFile" type="xs:boolean" />
						</xs:extension>
					</xs:simpleContent>
				</xs:complexType>
			</xs:element>
		</xs:sequence>
	</xs:complexType>
</xs:schema>
